{"aggregate_sha256":"e22edc5db73d3b99f7a16ef7ead3f7c70df6a449fe5da03569af73fed3d8fa7d","artifact_id":"full-rag-holdout-r03-vector-fingerprint-v1","collection_name":"nexodocs_chunks_v1","distance":"Cosine","point_count":44,"points":[{"chunk_id":"nsi-chk-9aade215cab940975e6ec676","payload_sha256":"a38cff1e88f31d16e6d84be70d12ae9ab35d28511f346ad6261af588f4f434a0","point_id":"01b45d67-556b-56b1-9a39-d7ec0e3016a4","vector_dimensions":1536,"vector_sha256":"8f511da051db39baeb6e227f5bdc2504300dc42182395c47d59a63992686ddbe"},{"chunk_id":"nsi-chk-d74a870aa98d53559ff2d989","payload_sha256":"5ca9658a8583d8593fca8ccee7fffac3e8063270344a47657b989eb0063f2cf2","point_id":"01cfcb23-7c34-5df4-9ab1-58fb167e66e8","vector_dimensions":1536,"vector_sha256":"fa2b55a3f3956832dfff769868ceb0db248500b7b71488e2e04bf021403fc879"},{"chunk_id":"nsi-chk-a4050c068fdb897db1ea291a","payload_sha256":"f19c9d755ec8b72745afe67c57f6b2d085f57d35fb993beba811b9285e9645f8","point_id":"092c2478-9c65-57cf-9969-124a2176eeb9","vector_dimensions":1536,"vector_sha256":"abe246508dbb8fc4f5a2d86a37e822ed2f8f8acdcbe885f4dc57fede4af57568"},{"chunk_id":"nsi-chk-a0656258791ed3eeb3e6bd3d","payload_sha256":"ddf2ec87c1e2c1f93c49ba55a323c415d7b42e5f0ed05277789f591a60b79e13","point_id":"18eff6e3-c300-588c-a9fc-e0cdb6f9b407","vector_dimensions":1536,"vector_sha256":"c627a170ff4340004df59e0c2c8162589100225361afe8182adff248295408e6"},{"chunk_id":"nsi-chk-66a326495048fb62c46e63a6","payload_sha256":"208dec13b020c92fa35c47608d8a60bc216cec766f5bda754d2a85c000e09ff4","point_id":"199fc9c1-fca9-570c-b2c2-6e6f5bc72149","vector_dimensions":1536,"vector_sha256":"7ce4ac9e4c369dde6373a235fbc8f5d50ac31e1011963d7736aba8f008234ae1"},{"chunk_id":"nsi-chk-89c6c70a09012b7ebc9e89e5","payload_sha256":"e47a82d164321ba4aab861161d6d31e6238dacd9341152969569cf40713666fe","point_id":"248a670d-47ae-507b-bb23-2ca35ca3863c","vector_dimensions":1536,"vector_sha256":"2e8a28cf5cec0defa08d5726b316c2115b6ba5bd0caee8e2892cf589af28af17"},{"chunk_id":"nsi-chk-4b960a5742854551d2ab7544","payload_sha256":"efeed936282e80dd2fe4c0da2d04118268bd89f65e2db20e2de3c40d3bf48066","point_id":"27b73da0-c5af-5864-b416-e3164c20a292","vector_dimensions":1536,"vector_sha256":"15dcbeea37256d996c96d9980b2ad4348b3933aac31a56f20a92546b2352bed3"},{"chunk_id":"nsi-chk-34440f6e59145f210ca5585e","payload_sha256":"298d2af8ebc0caa11a4a741de7381e7e64cdfe0266564c669a3d6c5909539aa0","point_id":"282b39ce-82c8-5dc3-ba9d-d484500a5891","vector_dimensions":1536,"vector_sha256":"d9f1c060212f29cad03168bb97dfae339ad5af76689797f3b32323435a268aa9"},{"chunk_id":"nsi-chk-9bef4b3b73c26c5e95a18e36","payload_sha256":"10c89d94c6057ade7436d566ccba5f901ee774fcce6cf828a87b6bbadb483e85","point_id":"28c3a76b-1018-51f6-af26-be4a8f92982d","vector_dimensions":1536,"vector_sha256":"a26936dbf71e076892b91e4cb8e978f7047ac1af43cd26a4896022f53b8ef3da"},{"chunk_id":"nsi-chk-69a386d85c5a42817d2c0bca","payload_sha256":"9185149251fe139e43c5ebd2d3d4a87174ac61652fb292197d84c24c880b0744","point_id":"29019755-5e2a-5892-bd8e-d6bb81c8a0dd","vector_dimensions":1536,"vector_sha256":"61e6314f55d29f377e38534dbd0502dee665eaba0f91f4118e3e49da9a45cf88"},{"chunk_id":"nsi-chk-9e22b7d55629ed9f43f3d40c","payload_sha256":"a9f22a64b2c110d81fb17e6dbf5765f15a9350ae382b6686b3004e1b53be1d63","point_id":"2a8923be-e86d-55d0-8dc6-17735250c263","vector_dimensions":1536,"vector_sha256":"4c001b3dc2d45614e920361141da70f180b0132ef064fe30c967bb27906f8a2e"},{"chunk_id":"nsi-chk-992852066102ac0247306d95","payload_sha256":"8a1110f3b85203f928811b97b469ad30df885edd66d1673434655bcf54fdcaff","point_id":"3b74353a-69e0-59c9-8c8a-37e4b0dab2c0","vector_dimensions":1536,"vector_sha256":"9ee63fdca8768219c4dc8dd8370d77830f744d8752683b80617e0a1b929d14e0"},{"chunk_id":"nsi-chk-787a6e804510939de57a7899","payload_sha256":"a9582b9bda4721ceaa217098cfe3b4e024fe1b8220158b50dff7d754841888c8","point_id":"3fbf9063-009c-5917-96c3-65febe2b0f49","vector_dimensions":1536,"vector_sha256":"a9aa5c24d4574909a27fa734a97e0c82a96d83493e7de3d02507a4ed223547b1"},{"chunk_id":"nsi-chk-6200daa142d816b33f8dab68","payload_sha256":"f95a44374d63db7ed2dac9cb7fe1301cc4ab8dc5b43d9759954a0af93354e5f7","point_id":"40e30a64-a3db-569c-9fd0-100889e99521","vector_dimensions":1536,"vector_sha256":"658f61ab8cb00254ea09dab355a93631efde8d646afb6cd7b423bcbaa2c79850"},{"chunk_id":"nsi-chk-1798fdd48feb4c7402e05563","payload_sha256":"a826be945098ece9c7039bfbd1d9db09b5f01049de30d3e630a1462cf4165bb2","point_id":"4fcbce8f-b9a9-52ee-81c9-1217bb577c69","vector_dimensions":1536,"vector_sha256":"41b2cf9ba7c55307e4e2c814a174d844843b52c644f1d0c177d9c4e93d29498a"},{"chunk_id":"nsi-chk-0a1d1dd8522c0f8729437e5b","payload_sha256":"4530f0fe3d101bd970e64bce8607818db4f132754e8fa982480fba34fddbdee2","point_id":"56c7563f-346b-578c-976d-91839dcaf951","vector_dimensions":1536,"vector_sha256":"f76c8ec0bb3b907cc2d334028ff727b01957e5a996986363617c979fe5c00fc6"},{"chunk_id":"nsi-chk-df9d81c2ec61c59fa96d1ae0","payload_sha256":"a0574662cc285faae95500121798d4ebb53b6c96aa03aaff05bab2c456bb5e52","point_id":"5c2e8335-7e2f-5b2f-be84-b61f10060453","vector_dimensions":1536,"vector_sha256":"5552a989fd77e482dff19e21f2fceb0af49e34cf06ac697ae322fb84cd029cc5"},{"chunk_id":"nsi-chk-c957a04edc38a17a82bfe041","payload_sha256":"5f84d4964c29bad41ed932788fd5e92f419462038460db13f8bfdb7b02ba5cee","point_id":"5edfc7cf-2add-5b5d-9dff-2b78193fb4a6","vector_dimensions":1536,"vector_sha256":"6b095eb2d16ca5de2286806777368f3d18b3295e8f3227c0b62f9702322d7c23"},{"chunk_id":"nsi-chk-0c774dace3fe3952cfbe002c","payload_sha256":"f2fd5ae991e36449f9e76e4b8bf06cc2911d33f0465a3c4806c9ba4b1204f6d0","point_id":"660d7286-e0a8-52fb-8c39-e40b23b84e3c","vector_dimensions":1536,"vector_sha256":"1591d8c0c65020623c0ef30f5bd055f78bdd8f1aaa385ca90d9f6dadd59a71ed"},{"chunk_id":"nsi-chk-7ddfd09f0c29c8ae6958863b","payload_sha256":"8fd5128218237536f97e8c0776900d53adf5d163dbb788e798f6b8f0701b0c55","point_id":"66ea34df-7eca-5cd4-ac08-e0e2da32303e","vector_dimensions":1536,"vector_sha256":"98f51ea5f90088b66011072cbedf63dadda04740b448838990cdeb900522d4bd"},{"chunk_id":"nsi-chk-e5edfaef86e24204a29b2ca8","payload_sha256":"b5cecbee1d92eff9215686d5f908b114cc00594f421ababaeafd212f859d9eca","point_id":"725712a5-a9d4-55cb-8cc6-a0685a81dfe6","vector_dimensions":1536,"vector_sha256":"f0ca968ad6743f611ee687ac753fac3b25a6f83a5991d162f544b52c1ac4dad2"},{"chunk_id":"nsi-chk-f92159472e147e1f0f21dcdc","payload_sha256":"1a5954d61623f4d7eab8c0500244454468ea1ecd3ae18f5e143f522326c7090c","point_id":"765fdefe-d9b4-5ac1-bda8-09b2e96a9b86","vector_dimensions":1536,"vector_sha256":"6283c1d7f11615ba73d72fcb7905c5630deb54cc7615e5e402e0ccffd1761a98"},{"chunk_id":"nsi-chk-1864514bf23eac2a3c92c998","payload_sha256":"4a6e0d10395012d0695b1e4a5f1c267e228f1a4b6aa84d49c35c2c04543315bd","point_id":"77427cdd-544f-5398-9caf-e0ba48e28c36","vector_dimensions":1536,"vector_sha256":"a4d0ff498735df13e18cecca91921612fc1d728b197255b5c748374896285230"},{"chunk_id":"nsi-chk-c48c4cadfc4ce10dc005efd6","payload_sha256":"45f16309ff0d9e3ff1350498463d322e71043154e29d7a4303884b011864e10d","point_id":"7d4b8dd7-fe8c-5cf1-b077-8e9381b427c4","vector_dimensions":1536,"vector_sha256":"0302bbb9acd566107695ed529ae5e4ce01ec93e40e045e88fca3386a8dfa03d9"},{"chunk_id":"nsi-chk-9e318e6de5ac45221ebf0658","payload_sha256":"b25f2dc870a1b2d771ebc3a252370827c9cb35ddd9016116811fbdf9b8a3b92f","point_id":"943c6107-9f84-58c8-9fb6-7b60142a1925","vector_dimensions":1536,"vector_sha256":"ab18dc3235bfbddf6d9a0b775f3d6d564a3d0865cee29050f90f0ded767f5976"},{"chunk_id":"nsi-chk-e2a5d8ad59de4a5e7fab61a0","payload_sha256":"0ca744c6ebe7d5ac96a4d4242de38c4b657f1da6fbd09f6243e354149975b610","point_id":"96c5ed04-94df-52d1-a7a6-795e1773d10d","vector_dimensions":1536,"vector_sha256":"f2aa435f5a424588077e919ba9121d005bc594381dcd07f6fb7bda35d180fd25"},{"chunk_id":"nsi-chk-9c408fe00722c19b4c62d741","payload_sha256":"dfd0d0a86af70eef87ad10b9b55a1e74234fee12005fcf555a9ee1a30ed2a4ac","point_id":"a38815b8-3193-57a5-a0ed-9d89cb388da6","vector_dimensions":1536,"vector_sha256":"f1472af165503440ffee0c92cd0b032e3f7659c744bfbffa2e775402c25137e2"},{"chunk_id":"nsi-chk-1cdb2d28159caaafec968266","payload_sha256":"6082281c0e70f77cfe2dca324effcc96768fdaf68fc766e2baf30433ee2bbb6e","point_id":"a8aca2b7-ed96-51c1-bf2f-c4fe7167b752","vector_dimensions":1536,"vector_sha256":"487aeca49d9b2472b4fc2f93b9d0a228d9571567d8a332e357cf5dac3398b8eb"},{"chunk_id":"nsi-chk-7cb8f5b08dddf1f523778f05","payload_sha256":"ab818a218982d36369614fcf1b4fa6f977afd49fc259a22e389753f13370e644","point_id":"a9044920-63da-531c-9a26-a5842d80e2b8","vector_dimensions":1536,"vector_sha256":"6ce420657d83a99523842fcd11757ec53f9e46132d7b94ce25b0cdbc2dad9250"},{"chunk_id":"nsi-chk-618d89a2a097a876c14f8188","payload_sha256":"53e3f3fa64d7f2268288a4277e7e1b38ad49d0a5e46d4caeedb7a4aa61930e0e","point_id":"a94d0815-a131-5462-b0e9-6f4471b39929","vector_dimensions":1536,"vector_sha256":"a55cccbe4d187b11aff4b0b2b3a85f7a6b7bd554c684cad769331bfaeca81789"},{"chunk_id":"nsi-chk-13e0ff02127140dc090f80aa","payload_sha256":"19707fc7b349fda1c9924e6ecb40a24170454aa0acba27ed39d4dcb15baf9235","point_id":"b053b0db-ba10-52a8-82c1-f430b1de437f","vector_dimensions":1536,"vector_sha256":"e7773e7428e8c9c4e854a3501540bbaa64c51c4709a818f9a6e6a6acf4d5e72b"},{"chunk_id":"nsi-chk-c6ba1b5748429a103d348ee5","payload_sha256":"148f185058e31b28be286fb1e0b76e172b6ced952d95735ed1a98ec4b538051f","point_id":"b4381f18-8d31-54cb-a5db-775d442ef1f1","vector_dimensions":1536,"vector_sha256":"54562deacfffa6cd7f0e6b66d231a31f3daedeb472e646426025bbee31addaaa"},{"chunk_id":"nsi-chk-8d8e0c91e19851d460b03a08","payload_sha256":"c296e91ccd8fa7bcba8e197da99391f1368c4f0c43699df7b97f0c5a3886b846","point_id":"bacdd0e1-05a0-589e-8ddc-c752b1d81eb3","vector_dimensions":1536,"vector_sha256":"c3d0ff11f96d1145e5313aac3391434c2d45ce197db94760c9d40f6e9aa143d5"},{"chunk_id":"nsi-chk-f29bf2803f3918e8e1b2fa68","payload_sha256":"1a13f395b70ed5c6b4fc45c6b0de153198402c66ff9f7e2e4230c9aecb4cd266","point_id":"be00d9f4-2557-5097-aaf5-2c44dd98a34f","vector_dimension